{
  "date": "2026-08-29",
  "lineage_id": "Lb29c68472b",
  "cluster_id": 104,
  "cluster_name": null,
  "salience_score": 2.75,
  "top_tokens": [
    "west",
    "bank",
    "killed",
    "strike",
    "gaza",
    "israel",
    "palestinian",
    "israeli",
    "rare",
    "three"
  ],
  "n_articles_total": 11,
  "n_outlets": 9,
  "n_countries": 8,
  "n_langs": 2,
  "countries_present": [
    "china",
    "france",
    "israel",
    "pakistan",
    "pan_arab",
    "turkey",
    "vietnam_thai_my",
    "wire_services"
  ],
  "langs_present": [
    "en",
    "fr"
  ],
  "leans_present": [
    "CPC state — world section",
    "Critical of Gulf monarchies",
    "French wire — European angle",
    "Left-liberal / critical of govt",
    "Pro-government / AKP",
    "Public broadcaster — international",
    "Right-leaning establishment",
    "Singapore establishment",
    "State agency — pro-government"
  ],
  "signal_breakdown": {
    "summary": 11
  },
  "corpus": [
    {
      "outlet": "AFP / France 24 EN",
      "country": "wire_services",
      "country_label": "Wire Services (Factual Baseline)",
      "lang": "en",
      "lean": "French wire — European angle",
      "section": "wire",
      "title": "Several killed in Israeli strikes on Gaza and West Bank",
      "link": "https://www.france24.com/en/several-killed-in-israeli-strikes-on-gaza-and-west-bank",
      "signal_level": "summary",
      "signal_text": "Several killed in Israeli strikes on Gaza and West Bank\n\nIsraeli strikes in Gaza have killed five people, local hospital officials said Friday. Two brothers and another relative died in a strike on the family’s home outside Khan Younis, officials at Nasser Hospital said. Two separate Israeli strikes killed one person each in Gaza City, according to health officials at Shifa hospital.",
      "extraction_status": null,
      "via_wayback": false
    },
    {
      "outlet": "AFP / France 24 EN",
      "country": "wire_services",
      "country_label": "Wire Services (Factual Baseline)",
      "lang": "en",
      "lean": "French wire — European angle",
      "section": "wire",
      "title": "Israel army carries out rare West Bank air strike, killing 'three terrorists'",
      "link": "https://www.france24.com/en/middle-east/20260828-israel-army-carries-out-rare-west-bank-air-strike-killing-three-terrorists",
      "signal_level": "summary",
      "signal_text": "Israel army carries out rare West Bank air strike, killing 'three terrorists'\n\nIsrael's military said it carried out an air strike in the Jenin area in the West Bank on Friday that killed a ​Palestinian it described as a Hamas militant operative as well as two of his accomplices, in a rare use of deadly Israeli air power in the occupied territory.",
      "extraction_status": null,
      "via_wayback": false
    },
    {
      "outlet": "AFP / France 24 FR",
      "country": "france",
      "country_label": "France",
      "lang": "fr",
      "lean": "Public broadcaster — international",
      "section": "news",
      "title": "Bombardement israélien à Jénine, en Cisjordanie occupée, au moins 3 morts",
      "link": "https://www.france24.com/fr/vid%C3%A9o/20260829-bombardement-isra%C3%A9lien-%C3%A0-j%C3%A9nine-en-cisjordanie-occup%C3%A9e-au-moins-3-morts",
      "signal_level": "summary",
      "signal_text": "Bombardement israélien à Jénine, en Cisjordanie occupée, au moins 3 morts\n\n⁠L'armée israélienne a annoncé ​avoir tué vendredi lors d'une frappe de drone ​en Cisjordanie un activiste du Hamas ainsi que deux complices qui circulaient à bord d'une voiture dans la région ​de ‌Jénine.",
      "extraction_status": null,
      "via_wayback": false
    },
    {
      "outlet": "ARY News English",
      "country": "pakistan",
      "country_label": "Pakistan",
      "lang": "en",
      "lean": "Right-leaning establishment",
      "section": "news",
      "title": "Israel killed three Palestinians in rare West Bank airstrike",
      "link": "https://arynews.tv/israel-killed-three-palestinians-in-rare-west-bank-airstrike",
      "signal_level": "summary",
      "signal_text": "Israel killed three Palestinians in rare West Bank airstrike\n\nIsrael killed three Palestinians in rare West Bank airstrike",
      "extraction_status": null,
      "via_wayback": false
    },
    {
      "outlet": "Anadolu Agency English",
      "country": "turkey",
      "country_label": "Turkey",
      "lang": "en",
      "lean": "State agency — pro-government",
      "section": "news",
      "title": "Gaza death toll from Israel’s genocidal war nears 73,500 as 9 more Palestinians killed",
      "link": "https://www.aa.com.tr/en/middle-east/gaza-death-toll-from-israel-s-genocidal-war-nears-73-500-as-9-more-palestinians-killed/4040924",
      "signal_level": "summary",
      "signal_text": "Gaza death toll from Israel’s genocidal war nears 73,500 as 9 more Palestinians killed\n\nBody of another Palestinian recovered, 18 people injured over past 48 hours, Health Ministry says",
      "extraction_status": null,
      "via_wayback": false
    },
    {
      "outlet": "CGTN World",
      "country": "china",
      "country_label": "China",
      "lang": "en",
      "lean": "CPC state — world section",
      "section": "news",
      "title": "IDF says it conducted strike against 'terrorists' in Jenin area",
      "link": "https://news.cgtn.com/news/2026-08-28/news-1PYZ44YBqRG/p.html?UTM_Source=cgtn&UTM_Medium=rss&UTM_Campaign=World",
      "signal_level": "summary",
      "signal_text": "IDF says it conducted strike against 'terrorists' in Jenin area\n\nIDF says it conducted strike against 'terrorists' in Jenin area",
      "extraction_status": null,
      "via_wayback": false
    },
    {
      "outlet": "Daily Sabah",
      "country": "turkey",
      "country_label": "Turkey",
      "lang": "en",
      "lean": "Pro-government / AKP",
      "section": "news",
      "title": "3 Palestinians killed in Israeli drone strike in occupied West Bank",
      "link": "https://www.dailysabah.com/world/mid-east/3-palestinians-killed-in-israeli-drone-strike-in-occupied-west-bank",
      "signal_level": "summary",
      "signal_text": "3 Palestinians killed in Israeli drone strike in occupied West Bank\n\nAn Israeli drone strike killed three Palestinians in the occupied West Bank city of Jenin on Friday, with Israeli forces subsequently withholding their bodies, according to the Pal...",
      "extraction_status": null,
      "via_wayback": false
    },
    {
      "outlet": "Daily Sabah",
      "country": "turkey",
      "country_label": "Turkey",
      "lang": "en",
      "lean": "Pro-government / AKP",
      "section": "news",
      "title": "Gaza death toll reaches 73,449 as thousands remain missing",
      "link": "https://www.dailysabah.com/world/mid-east/gaza-death-toll-reaches-73449-as-thousands-remain-missing",
      "signal_level": "summary",
      "signal_text": "Gaza death toll reaches 73,449 as thousands remain missing\n\nThe death toll in Gaza has risen to 73,449 since Israel launched its war on the Palestinian enclave in October 2023, the Gaza Health Ministry said Saturday, as a Palestinian rights...",
      "extraction_status": null,
      "via_wayback": false
    },
    {
      "outlet": "Haaretz",
      "country": "israel",
      "country_label": "Israel",
      "lang": "en",
      "lean": "Left-liberal / critical of govt",
      "section": "news",
      "title": "IDF says three Palestinians killed in targeted strike near West Bank's Jenin",
      "link": "https://www.haaretz.com/west-bank/2026-08-28/ty-article/.premium/idf-says-three-palestinians-killed-in-targeted-strike-near-west-banks-jenin/000001a0-48fe-dad6-a3b6-5afe67890000",
      "signal_level": "summary",
      "signal_text": "IDF says three Palestinians killed in targeted strike near West Bank's Jenin\n\nThe Palestinian Red Crescent said Israeli troops delayed its medics and confiscated medical equipment. Defense Minister Katz said the Jenin refugee camp had been 'cleansed' of militants and terror infrastructure",
      "extraction_status": null,
      "via_wayback": false
    },
    {
      "outlet": "Middle East Eye",
      "country": "pan_arab",
      "country_label": "Pan-Arab / Middle East regional",
      "lang": "en",
      "lean": "Critical of Gulf monarchies",
      "section": "news",
      "title": "Israeli attacks increase Gaza death toll",
      "link": "https://www.middleeasteye.net/live-blog/live-blog-update/israeli-attacks-increase-gaza-death-toll",
      "signal_level": "summary",
      "signal_text": "Israeli attacks increase Gaza death toll\n\nIsraeli attacks increase Gaza death toll The Palestinian health ministry said new Israeli attacks killed nine Palestinians and injured 18 others in the past 48 hours. The ministry said one body was recovered from the rubble of previous Israeli attacks. The new attacks put the death toll from Israel's war on Gaza at 73,449 Palestinians, and 174,472 injured since 7 October 2023.",
      "extraction_status": null,
      "via_wayback": false
    },
    {
      "outlet": "Straits Times",
      "country": "vietnam_thai_my",
      "country_label": "Vietnam / Thailand / Malaysia / Singapore",
      "lang": "en",
      "lean": "Singapore establishment",
      "section": "news",
      "title": "Israel kills Hamas operative in rare West Bank air strike, military says",
      "link": "https://www.straitstimes.com/world/middle-east/israeli-strike-kills-three-in-west-bank-israel-says-it-targeted-hamas-operative",
      "signal_level": "summary",
      "signal_text": "Israel kills Hamas operative in rare West Bank air strike, military says\n\nJENIN, West Bank, Aug 28 - An Israeli strike killed a Hamas operative and two of his accomplices in the West Bank on Friday, the military said, in a rare use of deadly air power in the occupied territory.",
      "extraction_status": null,
      "via_wayback": false
    }
  ],
  "coverage_caveats": [],
  "meta_version": "10.0.3"
}